name,district,state,description,category,best_time_to_visit,estimated_cost,anchor_location,underrated_score
Floating Village on Dal Lake (Sophie Village),Srinagar,Jammu & Kashmir,"Experience a unique way of life in a self-sustaining community living directly on the water. Discover floating shops, schools, salons, and even playgrounds, all navigated by small boats, offering an authentic and peaceful glimpse into local culture, often compared to Venice.",Cultural/Historic Site,,Budget-friendly,Srinagar,7
Local Vegetable Market on Dal Lake,Srinagar,Jammu & Kashmir,Witness the vibrant daily commerce of Dal Lake as local vendors sell and negotiate prices for fresh produce directly from their boats in this bustling early morning floating market.,Activity,Every morning,Free,Srinagar,3
Kashi Labh Mukti Bhawan (Moksha Bhawan),Varanasi,Uttar Pradesh,"A unique spiritual home in Kashi where individuals come to spend their final days, believing it leads to liberation from the cycle of rebirth. It provides a peaceful atmosphere through constant bhajans and chants, offering a profound glimpse into local spiritual practices surrounding life and death.",Cultural/Historic Site,,Budget-friendly,Varanasi,8
Jhilmil Ramleela,Jhilmil,Delhi,"A decades-old community Ramleela, active since 1962, celebrated for its authentic performances, profound local devotion, and dedicated amateur artists. It offers a unique, non-commercialized experience of Lord Ram's story, distinct from larger, more crowded events.",Event/Festival,Navratri season (late September to October),Free,Jhilmil,6
Dras (The Coldest Inhabited Place),Kargil,Ladakh,"Brave the extreme temperatures of Dras, India's coldest inhabited place, to experience its unique local culture, the resilience of its people, and breathtaking frozen landscapes, making it an adventurous winter destination.",Natural Landmark,Winter,Moderate,Leh,6
Ahmad Bhai's Homestay,Kargil,Ladakh,"Experience genuine home-like hospitality and warmth in Dras, offering comfort and a personal touch that makes staying away from home feel remarkably close to it.",Cultural/Historic Site,Winter,Budget-friendly,Dras,3
Sheena and Balti Culture of Dras,Kargil,Ladakh,"Discover the distinct Sheena and Balti languages and rich cultural heritage of Dras, revealing a unique identity that sets its people apart from typical perceptions.",Cultural/Historic Site,,Free,Dras,3
Frozen Waterfalls of Dras,Kargil,Ladakh,"Hike to a 'very amazing' frozen waterfall, a rare and magical spectacle that none of the participants had seen before, making it a unique natural wonder.",Natural Landmark,Winter,Free,Dras,3
Dras Hydroelectric Power Plant (Spontaneous Visit),Kargil,Ladakh,"Embark on a truly random and unexpected visit to a local hydroelectric power plant, where you can learn about electricity generation and experience incredible local hospitality, including tea and hot water.",Activity,Winter,Free,Dras,6
Frozen River/Stream in Dras,Kargil,Ladakh,"Marvel at the captivating sight of a completely frozen river or stream, a beautiful natural wonder highlighting the extreme winter conditions of Dras.",Natural Landmark,Winter,Free,Dras,3
Republic Day Celebration at Dras (near Tiger Hill),Kargil,Ladakh,"Witness a profoundly patriotic and heartwarming Republic Day celebration right below the iconic Tiger Hill in Dras, experiencing the spirit of India amidst extreme cold and with local people.",Event/Festival,January 26th,Free,"Dras, Tiger Hill",3
Harihar Fort,Nashik,Maharashtra,"A challenging fort to climb, offering a significant and memorable physical experience for travelers seeking adventure and less-traveled paths.",Cultural/Historic Site,,Budget-friendly,Nashik,3
Keylong to Leh Bus Journey,"Lahaul & Spiti, Leh","Himachal Pradesh, Ladakh","Experience a challenging yet incredibly rewarding 36-hour bus journey through stunning Himalayan landscapes, including three high-altitude mountain passes. Many travel enthusiasts undertake this journey specifically for the scenic experience, often finding it more beautiful than the destination itself.",Activity,,Budget-friendly,Leh,7
Patal Cave,Uttarkashi,Uttarakhand,"Discover a secluded, deep cave near Gangotri, accessible by an uncommonly used path, offering a unique sense of energy and spiritual quiet away from crowded routes.",Natural Landmark,,Free,Gangotri,3
Interaction with Mata Ji in the Forest,Uttarkashi,Uttarakhand,"Experience a truly unique cultural interaction by meeting Mata Ji, a spiritual woman living alone in the forest near Gangotri, for an authentic glimpse into local life and wisdom.",Activity,Winters (or colder months),Free,Gangotri,3
Harshil Village,Uttarkashi,Uttarakhand,"Explore a beautiful, 'unheard of' village 30km from Gangotri, celebrated for its authentic old architecture, serene Ganga riverside setting, and local apple orchards, providing a non-touristy, culturally rich experience.",Cultural/Historic Site,,Budget-friendly,Gangotri,9
Pandav Nritya Festival,Uttarkashi,Uttarakhand,"Witness a vibrant, 3-day local festival in Harshil, featuring the mythical Pandava Nritya, a communal village feast, and the unique, animal-friendly ritual of symbolic pumpkin sacrifices, offering an incredibly deep and personal cultural immersion.",Event/Festival,Late autumn/early winter (coinciding with snowfall),Free,Harshil Village,9
Devta Possession Experience,Uttarkashi,Uttarakhand,"Gain profound insight into local Garhwali spiritual traditions by observing and discussing the phenomenon of Devta possession, a powerful and rarely witnessed cultural event during the Pandav Nritya festival.",Activity,During the Pandav Nritya Festival,Free,Harshil Village,6
Bhagirathi Homestay,Uttarkashi,Uttarakhand,"Stay at this 'lovely' homestay in Bagori village, offering comfortable accommodation and an unparalleled opportunity for cultural immersion, especially for experiencing local festivals and traditions directly with welcoming hosts.",Cultural/Historic Site,,Budget-friendly,Harshil Village,3
Vivek Express Journey (Dibrugarh to Kanyakumari),Dibrugarh,Assam,"Embark on India's longest train journey, a 78-hour adventure offering an unparalleled opportunity to witness India's diverse landscapes, meet fascinating co-passengers, and create lasting memories and connections over several days.",Activity,,Moderate,"Dibrugarh, Assam",7
IRCTC E-catering Service,Jalpaiguri,West Bengal,"Discover the surprisingly efficient IRCTC e-catering service, allowing you to order a wide variety of meals, including fast food like Domino's pizza, delivered directly to your seat at various stations along the train route.",Food Joint,,Budget-friendly,"Jalpaiguri, West Bengal",7
Kashmir Auto Drivers Association Free Tourist Service,Srinagar,Jammu and Kashmir,"A unique community-led initiative offering free auto services to tourists for local travel within Srinagar, including transfers to hotels or other destinations. This service provides valuable support, especially during times of travel disruption or strikes.",Activity,,Free,Srinagar,6
Japanese Sleeper Train Journey,Multiple Regions,Japan,"Experience Japan at a slower, more authentic pace by opting for an overnight sleeper train journey. These trains offer private rooms and a unique travel perspective, diverging from the common Bullet train experience.",Activity,Overnight,Moderate,Tokyo,7
Kusatsu Onsen (Hot Spring Town),Agatsuma District,Gunma Prefecture,"Discover a beautiful hot spring town nestled in the mountains, known for its healing onsens, traditional Japanese architecture, and relaxing foot-soaking areas. It offers a truly wholesome cultural experience that feels even more captivating in person than in photos.",Cultural/Historic Site,,Budget-friendly,Tokyo,7
Local Cafe by a Pond,Agatsuma District,Gunma Prefecture,"Enjoy an authentic local dining experience at a serene cafe situated by a tranquil pond, recommended by locals near Kusatsu Onsen. It's a perfect spot for lunch or coffee, offering a peaceful atmosphere and unique local treats like ice cream with bread.",Food Joint,Daytime for lunch or coffee,Budget-friendly,Kusatsu Onsen,7
Rajdhani First Class Private Coupe Journey,New Delhi,Delhi,"Experience unparalleled privacy, comfort, and a sense of luxury while traveling. Enjoy home-like unlimited food, quiet surroundings perfect for work or reading, and fulfill a childhood dream of refined, solitary train travel.",Activity,,Moderate,Delhi,6
Random Village near Aluva,Ernakulam,Kerala,"Discover authentic local life and experience unexpected enjoyment by exploring an unnamed, non-mainstream village, promising an adventure so fun it's hard to describe.",Cultural/Historic Site,,Budget-friendly,Aluva,7
Drass (Extreme Winter Experience),Kargil,Ladakh,"Visit Drass, the world's second coldest inhabited place, to experience extreme winter conditions, witness heavy snowfall, and attempt the unique water vaporization phenomenon in sub-zero temperatures. Immerse yourself in the resilience of local life.",Activity,Peak winters (December-January),Moderate,Kargil,9
Secret Waterfall & 1994 Bridge Adventure,Kargil,Ladakh,"Embark on a local-guided trek through deep snow to a secluded waterfall and cross a historic, partially broken bridge from 1994, offering an exhilarating and authentic winter adventure that reveals the 'real Drass'.",Activity,"Winter, especially after heavy snowfall",Free,Drass,9
Mama Ka Dhaba,Kargil,Ladakh,"Savor Mama's famous Kahwah and enjoy warm local hospitality at this popular community eatery located opposite the Higher Secondary School, a true local favorite for an authentic taste of Drass.",Food Joint,,Budget-friendly,Drass,6
Republic Day Celebration in Drass,Kargil,Ladakh,"Witness a beautiful and proud Republic Day celebration at the main school in Drass, amidst heavy snowfall, offering a unique insight into the community's patriotic spirit beneath Tiger Hill.",Event/Festival,January 26th,Free,Drass,3
Mr. Ahmed's Homestay,Kargil,Ladakh,"Experience authentic local life and immerse yourself in the extreme cold of Drass by staying with Mr. Ahmed and his family, receiving genuine hospitality and a deeper cultural connection.",Accommodation,Winter,Budget-friendly,Drass,3
Hastinapur,Meerut,Uttar Pradesh,"The ancient capital of the Kuru Kingdom from the Mahabharata period, this historic town offers a rich glimpse into India's past, surprisingly devoid of large crowds, providing an authentic and overlooked historical experience.",Cultural/Historic Site,,Budget-friendly,Delhi,9
Boorhi Ganga,Meerut,Uttar Pradesh,"Located within Hastinapur, this small stream is believed to be the original course of the Ganga River during the Mahabharata era, offering a unique, historical connection to ancient Indian mythology.",Natural Landmark,,Free,Hastinapur,3
Duke Nose,Lonavala,Maharashtra,"Offers a challenging and authentic cliffside trekking and camping experience, providing a raw and memorable encounter with nature, especially during adverse conditions, highlighting a unique survival story.",Activity,,Budget-friendly,Lonavala,3
Film and Television Institute of India (FTII),Pune,Maharashtra,"An inspiring and 'incredible place,' considered a 'temple' for film enthusiasts, offering a unique opportunity to explore Asia's oldest functioning studio, witness daily film screenings, and discover historical sites like the Wisdom Tree where cinematic legends once taught.",Cultural/Historic Site,,Budget-friendly,Pune,6
Sri Vaidyanatheshwara Temple,Mysuru,Karnataka,"This ancient temple, located in the historic town of Talakad along the Kaveri River, offers a profoundly peaceful and uncrowded spiritual experience. It is part of a legendary town where 35 grand temples were once buried under sand due to a curse. The temple showcases millennia-old architecture and emanates a powerful presence of Lord Shiva, providing a unique opportunity for deep personal reflection, especially during the evening aarti.",Cultural/Historic Site,Evening (for Aarti),Free,Kaveri River bank,3
Kullu Dussehra,Kullu,Himachal Pradesh,"A unique, week-long festival that begins after Ravana's departure in the rest of India. Deities from all over Himachal gather for a grand chariot procession, alongside sports competitions, music festivals, and cultural performances, showcasing the deep faith and belief of the local people.",Event/Festival,October,Free,Kullu,8
Kasu Onsen,,,"Visit this mountainous town, tucked away from usual tourist routes, for a unique Onsen experience and breathtaking sunset views that will leave you in awe.",Cultural/Historic Site,"Evening, at sunset",,Tokyo,8
Chilla Dam Wilderness Trek (within Raja Ji National Park),Haridwar,Uttarakhand,"Embark on an arduous and thrilling nocturnal trek through a dense, elephant-rich wilderness towards Chilla Dam. Experience breathtaking views of the full moon reflecting on the river, with wild elephants visible, offering an unforgettable, adventurous, and authentic encounter with nature.",Activity,"Night (for the unique adventure described, though risky); alternatively, dawn/dusk for safer wildlife viewing.",Budget-friendly,Haridwar,3
Rest House Staff Quarters near Chilla Dam,Haridwar,Uttarakhand,"Discover an unexpectedly found sanctuary offering basic but profoundly comforting accommodation deep within the jungle. This 'life-saving' shelter provides a unique and authentic stay experience for those venturing into the wilderness near Chilla Dam, serving as an immense relief after a challenging journey.",Cultural/Historic Site,"After an adventurous trek through the wilderness, especially at night.",Budget-friendly,Chilla Dam,3
Narmada Parikrama (Padayatra segment),Multiple,Madhya Pradesh,"An immersive walking journey along the sacred Narmada River, offering unique encounters with local culture and people, away from mainstream tourism. It’s a test of physical and mental endurance, leading to unexpected 'small magics' and profound personal reflections.",Activity,,Free,Omkareshwar,4
Community Free Water Service Points,Multiple,Madhya Pradesh,"Publicly available water stations generously set up by local communities along the Narmada Parikrama route, offering essential hydration to travelers. This highlights the region's deep sense of hospitality and local support, especially vital in hot weather.",Cultural/Historic Site,Hot weather,Free,Omkareshwar,3
Encounter with the 'Talking Pandit',Rural area,Madhya Pradesh,"A highly random and entertaining roadside encounter with a talkative Pandit who offers free sugarcane juice. This interaction provides a unique glimpse into local life and candid thoughts, which the speaker describes as an 'unprecedented randomness' not typically experienced.",Event/Festival,,Free,Narmada Parikrama Route,6
Rural Canal-side Roads,Rural area,Madhya Pradesh,"A peaceful and authentic alternative to main roads, winding through villages alongside a canal. This route offers refreshing shade from trees and a sense of 'small magic' and connection with local life, providing a much more enjoyable experience than the exposed main roads.",Natural Landmark,Daytime (for shade),Free,Narmada Parikrama Route,7
Sundardham Ashram,Rural area,Madhya Pradesh,"A welcoming spiritual retreat offering free accommodation and food for Narmada devotees and travelers. It provides a unique glimpse into the ascetic life of saints, continuous devotional singing, and opportunities for deep cultural immersion and memorable interactions with its residents.",Cultural/Historic Site,,Free,Narmada Parikrama Route,6
Encounter with the 'Delusional Mata ji' at Sundardham Ashram,Rural area,Madhya Pradesh,"A deeply bizarre and unforgettable interaction with an elderly woman at Sundardham Ashram who offers food and then recounts elaborate, yet delusional, stories about meeting prominent political figures. The speaker describes this experience as 'crazy,' generating 'goosebumps,' and part of 'stories that are tough to imagine,' highlighting its profound and non-mainstream uniqueness.",Event/Festival,,Free,Sundardham Ashram,9
International Monasteries of Bodh Gaya,Bodh Gaya,Bihar,"Discover a unique collection of diverse monasteries from countries like Japan, China, Thailand, Bhutan, and Mongolia, offering a peaceful glimpse into global Buddhist architecture and practices. Many are often empty, providing a serene atmosphere away from the main crowds.",Cultural/Historic Site,,Budget-friendly,"Mahabodhi Temple, Bodh Gaya",6
Metta Buddha Monastery,Bodh Gaya,Bihar,Visit what is arguably the most beautiful monastery in Bodh Gaya. Its stunning beauty and serene ambiance make it a compelling stop for spiritual seekers and architecture enthusiasts.,Cultural/Historic Site,,Budget-friendly,"Mahabodhi Temple, Bodh Gaya",7
Free Ration Distribution Event,Bodh Gaya,Bihar,"Witness a recurring community event at a local meditation center where free rations (5 KG rice and 1 liter oil) are distributed monthly. It offers a unique, non-mainstream insight into the local social fabric and community support.",Event/Festival,Monthly,Free,Bodh Gaya,3
Ancient Nalanda University Ruins,Nalanda,Bihar,"Explore the majestic ruins of the world's first residential university, a global center of knowledge for 700 years. This site offers a profound historical journey, revealing stories of ancient academic excellence and a pivotal moment in India's intellectual past.",Cultural/Historic Site,,Moderate,Bodh Gaya,4
Dev Deepawali Festival,Varanasi,Uttar Pradesh,"Witness the spectacular illumination of every ghat with thousands of lamps, creating a celestial atmosphere believed to be graced by deities bathing in the Ganga. It's described as the best possible day to visit, transforming the city into a vibrant spectacle of light and devotion.",Event/Festival,The day of Dev Deepawali (Kartik Purnima),Budget-friendly,Varanasi,6
Harishchandra Ghat (during Dev Deepawali),Varanasi,Uttar Pradesh,"Experience the unique and surprisingly vibrant transformation of Harishchandra Ghat, typically solemn, as it glows with countless lamps during Dev Deepawali, offering a profound and serene perspective that alleviates any usual apprehension.",Cultural/Historic Site,The night of Dev Deepawali,Free,Varanasi,3
Jasmin Calendar & Supercar Launch Event,Noida,Uttar Pradesh,"An exclusive brand launch event featuring the unveiling of the 2022 Jasmin calendar, photographed by 'Paaji', and the highly anticipated debut of a new supercar. The event offers a vibrant atmosphere with music, dancing, and a first-hand look at cutting-edge automotive design.",Event/Festival,Morning (as mentioned in the transcript for the launch),Free,Noida,3
Ganpati Visarjan,Mumbai,Maharashtra,"Experience the vibrant joy and deep community spirit during the immersion of Ganesh idols, offering a truly authentic cultural insight into Mumbai's local traditions.",Event/Festival,"During the Ganesh Chaturthi festival, specifically the day of Visarjan.",Free,Mumbai,3
Lakeside Retreat with Unique Lake-Facing Rooms,Not specified,Not specified,"Experience very unique rooms that offer a direct and beautiful view of a serene lake right from your window, providing a distinctive and scenic experience.",Natural Landmark,,Moderate,Not specified,3
Sree Talhan Sahib Gurudwara (Airplane Gurudwara),Jalandhar,Punjab,"A unique religious site where devotees, particularly youth, offer toy airplanes and pray for their foreign visa applications to be approved, especially for countries like Canada and Australia. It offers a glimpse into local aspirations and a vibrant community experience.",Cultural/Historic Site,,Budget-friendly,Jalandhar,7