name,district,state,description,category,best_time_to_visit,estimated_cost,anchor_location,underrated_score
Playing cricket with local children,Varanasi,Uttar Pradesh,"Engage in an impromptu cricket match with local children, an activity that offers unexpected joy and a memorable cultural exchange, proving to be more enjoyable than standard sightseeing.",Activity,,Free,Varanasi,6
Local Cricket Match with Kids,Varanasi,Uttar Pradesh,"Engage in a spontaneous cricket match with local children for a truly authentic, joyful cultural exchange that provides more fun than traditional sightseeing.",Activity,,Free,Varanasi,3
Sadalpur Abhilekh (Sadalpur Inscription),Shahdol,Madhya Pradesh,"An ancient, historically significant inscription site that is largely unknown, even to many locals. Its obscurity makes it a truly off-the-beaten-path destination for those seeking unique cultural experiences away from mainstream tourism.",Cultural/Historic Site,,Budget-friendly,Shahdol,9
Robot Barista Coffee Experience (featuring Robot Tom),Tokyo,Tokyo Prefecture,"Experience an automated robot barista preparing your coffee via a vending machine, showcasing Japan's cutting-edge technology and unique service innovations.",Food Joint,,Budget-friendly,Tokyo,3
A Land,,,"An entertainment zone within Comic Con offering a variety of engaging experiences, including racing and a unique game booth for creating personalized superhero avatars.",Activity,During Comic Con,Budget-friendly,Comic Con Venue,3
Personalized Superhero Avatar Game Booth,,,An interactive booth where visitors can create a unique gaming hero avatar based on their personality and give it a distinctive name with the help of Jamnay.,Activity,During Comic Con,Budget-friendly,A Land (within Comic Con Venue),4
Jemina Podcast Room,,,"A dedicated space where participants can compare their unique superhero avatars and await results from Jemina to determine whose hero is more powerful, completing the interactive avatar creation experience.",Activity,During Comic Con,Budget-friendly,A Land (within Comic Con Venue),3
Shivanasamudra,Mandya,Karnataka,"Experience profound peace and quiet, allowing your mind to calm and fully absorb the serene natural surroundings, offering a unique respite from daily stresses.",Natural Landmark,,Budget-friendly,Kaveri River,3
Shaam Ko (Naga Wooden Gong/Drum),Kohima,Nagaland,"Discover a unique Naga cultural artifact, a wooden gong or drum that was historically used for various ceremonial and warning purposes. Its most striking feature is its historical use as a display for the heads of defeated enemies, around which victorious warriors performed celebratory dances, offering a profound glimpse into ancient tribal traditions.",Cultural/Historic Site,During the Hornbill Festival (first week of December),Budget-friendly,"Kisama Heritage Village, Kohima",6
Secret Waterfall with Mythical Origin,Leh,Ladakh,"Discover a unique waterfall that flows defiantly amidst the bone-chilling cold, where everything else is frozen. It's believed to have emerged miraculously from within a mountain, carrying a captivating mythical origin story involving a Lama and a magical box.",Natural Landmark,Winter,Free,"Leh, Ladakh",9
Mad Island,Mumbai Suburban District,Maharashtra,"Experience a local, authentic stay by crossing the sea, away from typical tourist accommodations in main Mumbai. It offers a unique getaway, possibly with beach access, ideal for an evening bike ride.",Natural Landmark,Evening,Budget-friendly,Mumbai,5
Rajdhani First Class Train Journey,Mumbai,Maharashtra,"Experience a luxurious 18-hour train journey from Mumbai to Delhi, featuring a private cabin for solo travelers, unlimited home-like meals, and dedicated attendant service. It offers a comfortable and unique travel alternative to standard flights.",Activity,,Moderate,Mumbai,6
Cute Dhaba serving Indian Muslim Cuisine,Dibrugarh,Assam,"Discover a delightful, unassuming dhaba near the station that offers surprisingly delicious and authentic Indian Muslim cuisine, providing a hearty and satisfying meal when hunger strikes.",Food Joint,Lunch,Budget-friendly,Dibrugarh Railway Station,6
Weekly Train Journey from Nalagan to Dibrugarh,Dibrugarh,Assam,"Embark on a beautiful, early morning weekly train journey from Nalagan to Dibrugarh, offering a unique and scenic travel experience.",Activity,Early morning (5 AM),Budget-friendly,Dibrugarh,3
Shivanasamudra Falls,Mandya,Karnataka,"Witness the Kaveri River in its magnificent 'full glory' at this waterfall, which marks the culmination of its 733 km journey from its source, offering a profound and spiritual perspective on its life cycle.",Natural Landmark,,Budget-friendly,Bangalore,6
Bibi Ka Maqbara,Chhatrapati Sambhaji Nagar,Maharashtra,"This monument, built by Aurangzeb, strikingly resembles the Taj Mahal, offering a unique architectural experience in Chhatrapati Sambhaji Nagar.",Cultural/Historic Site,,Budget-friendly,Chhatrapati Sambhaji Nagar,3
Anjanadri Betta (Hanuman's Birthplace Temple),Koppal,Karnataka,"Experience a challenging climb of 500 stairs to reach the temple believed to be Hanuman's birthplace, and witness a breathtaking sunset from the hilltop.",Cultural/Historic Site,Sunset,Budget-friendly,Hampi,3
"International Monasteries of Bodh Gaya (Chinese, Thai, Japanese, Bhutanese, Mongolian, Bangladeshi, etc.)",Gaya,Bihar,"Explore a diverse cluster of monasteries built by various Buddhist nations, each showcasing unique architectural styles and offering a distinct cultural and spiritual experience. It's a surprising discovery beyond the well-known Mahabodhi Temple.",Cultural/Historic Site,,Budget-friendly,"Mahabodhi Temple, Bodh Gaya",3
Ajanta Caves,Aurangabad,Maharashtra,"Explore ancient Indian artistry and magnificent paintings that showcase incredible technical brilliance from a bygone era, an experience so profound it can give you goosebumps.",Cultural/Historic Site,,Moderate,Aurangabad,3
Dimapur's Exotic Meat Market,Dimapur,Nagaland,"Explore a unique and surprising facet of local culture at this market, offering an array of non-mainstream meats like rats, frogs, rabbits, silkworms, hamsters, pigeons, and ducks. It provides an authentic and eye-opening glimpse into Nagaland's distinctive culinary traditions.",Cultural/Historic Site,,Budget-friendly,Dimapur,4
Shillong,East Khasi Hills,Meghalaya,"A captivating destination accessible via beautiful roads and scenic routes, offering stunning views and a vibrant atmosphere, particularly within its hostels. It was actively chosen over Guwahati for a more appealing travel experience.",Natural Landmark,,Moderate,Guwahati,3
Intimate Family Birthday Celebration,,,"A heartfelt, home-based gathering for a special occasion, offering a rare opportunity for genuine family connection and shared joy, often proving more fulfilling than elaborate events and culminating in deep happiness.",Event/Festival,Evening/Night,Budget-friendly,,3
Remote Himalayan Snow Leopard Tracking Route,Leh,Ladakh,"Embark on a challenging, off-the-beaten-path adventure to track snow leopards, offering the rare opportunity to witness these elusive big cats, potentially in unexpected and intense encounters, providing an unparalleled, adrenaline-fueled wildlife experience.",Activity,Winter evenings,Moderate,Leh,7
Overnight Stay in a Railway Station Dormitory,,,"Experience a surprisingly private and extremely budget-friendly overnight stay within a railway station's dormitory. It offers unexpected comfort, like individual seating in common areas, and often provides a peaceful, solitary lodging option for a minimal cost.",Activity,"Overnight, particularly when having an early morning train departure or late-night arrival.",Budget-friendly,,6
General Compartment Train Journey to Guwahati,,Assam,"Experience an authentic and unpredictable journey through the Indian rail network, offering genuine interactions with locals, opportunities to make new friends, and a taste of the raw, challenging yet memorable aspects of budget travel.",Activity,,Budget-friendly,Guwahati,3
Unexpected Lift and Spontaneous Journey,,,"Experience the rare and enriching kindness of strangers in Japan, turning an ordinary transit into a deeply memorable journey filled with unexpected stops for lunch and coffee, highlighting the beauty of solo travel and human connection.",Activity,,Free,Japan,7
Tuensang,Tuensang,Nagaland,"Tuensang offers a genuinely raw and special travel experience, distinct from mainstream destinations. Visitors will encounter authentic challenges, such as the need for in-person bookings, but these contribute to a unique sense of adventure and interaction with the local environment, providing a daily opportunity for discovery and connection.",Cultural/Historic Site,,Budget-friendly,Kiphire,6
Mattur Village,Shimoga,Karnataka,"Experience a unique cultural immersion in a village where residents exclusively speak and learn Sanskrit. It hosts a Gurukul preserving traditional Vedic education, offering a chance to step back in time, contrasting sharply with modern urban life.",Cultural/Historic Site,,Budget-friendly,Shimoga,7
Sunset at a South Goa Beach,South Goa,Goa,"Experience the serene and unmissable sunset views from a peaceful beach in South Goa, a moment highly prioritized for its tranquility.",Natural Landmark,Sunset,Free,Goa,3
Vande Bharat Express,India,India,"Experience India's fastest train, offering a surprisingly luxurious and efficient travel option with excellent hospitality and continuous meal service including tea, breakfast, juice, lunch, and ice cream.",Activity,,Moderate,India,7
Decorated Indian Truck Journey,,Multiple Indian States,"Immerse yourself in the vibrant subculture of Indian highways by experiencing a ride in a colorfully decorated long-haul truck, a unique and authentic way to travel across the country.",Activity,,Free,Delhi,3
Majuli Island,Majuli,Assam,"Visit the world's largest river island, accessible by ferry across the Brahmaputra River. It offers unparalleled beauty and peace, making you feel as if you've entered another world. Experience this unique destination soon, as it faces the risk of submerging in the near future.",Natural Landmark,,Budget-friendly,Brahmaputra River,3
Dras,Kargil,Ladakh,"Visit Dras, the world's second coldest inhabited place, to witness a resilient community thriving amidst extreme winters. Experience its vibrant local markets, observe traditional sports like archery, and be surprised by the warmth and beauty that defy common perceptions of this historically significant town.",Cultural/Historic Site,"Winter, especially around January",Budget-friendly,Kargil,7
Local Archery in Dras,Kargil,Ladakh,"Witness or even try the local sport of archery, passionately enjoyed by the residents of Dras even amidst heavy snowfall, offering a unique glimpse into their resilient way of life.",Activity,"Winter, during snowfall",Free,Dras,3
Republic Day Celebration in Dras,Kargil,Ladakh,"Experience the profound patriotism and vibrant community spirit of Dras locals as they celebrate Republic Day with full vigor, a moving sight in one of the world's coldest inhabited regions.",Event/Festival,January 26th,Free,Dras,3
Dras Valley,Kargil,Ladakh,"Experience extreme winter conditions with 6-8 feet of snow, where water freezes mid-air and temperatures can plummet to -60°C. It offers a dream-like, unique adventure few have witnessed.",Natural Landmark,Winter,Moderate,Kargil,7
Secret Second Cave,,,"This hidden cave offers a serene and authentic experience, discovered with a local's insight, providing a peaceful alternative to the crowded mainstream attractions.",Natural Landmark,Winter,Budget-friendly,Unspecified Tourist Destination,6
Grahan Village,Kullu,Himachal Pradesh,"A remote village showcasing a powerful example of community resilience, where locals brought high-speed internet to overcome the lack of mobile signals, offering a unique blend of traditional life and modern connectivity.",Cultural/Historic Site,,Budget-friendly,Kasol,4
Sleeping Pods,Mumbai,Maharashtra,"These top-class sleeping pods located within the station offer good AC, dedicated charging ports, privacy, and clean bathrooms, providing a comfortable and budget-friendly option for travelers needing a short rest.",Activity,,Budget-friendly,Chhatrapati Shivaji Maharaj Terminus,5
Blue Lassi Shop,Varanasi,Uttar Pradesh,"A unique lassi shop known for its over 100 varieties of delicious lassi and walls adorned with photos of visitors from around the world. Reaching it is an adventure in itself, involving a walk, a boat ride across the river, and navigating through narrow, authentic lanes.",Food Joint,,Budget-friendly,Varanasi City,6
Hidden Temples Alley Tour of Varanasi,Varanasi,Uttar Pradesh,"Embark on an intimate and authentic walking tour through Varanasi's ancient, winding alleys, guided by a local priest, to discover lesser-known, 'hidden' temples and gain unique local insights that most tourists miss.",Activity,Morning,Budget-friendly,Varanasi,9
Tulsidas Temple,Varanasi,Uttar Pradesh,"Visit this culturally significant temple in Varanasi, one of the 'hidden gems' revealed by locals, where the revered saint Tulsidas composed the epic Ramcharitmanas.",Cultural/Historic Site,,Free,Varanasi,8
Udupi,Udupi,Karnataka,"This coastal town served as the destination for a 12-13 day road trip, chosen for a significant personal event, a friend's wedding.",Cultural/Historic Site,,,Udupi,0
Friend's Wedding Celebration,Udupi,Karnataka,"A joyous and lively multi-day celebration in Udupi marking the union of friends who first connected through travel, characterized by dancing and a festive atmosphere.",Event/Festival,,,Udupi,0
Jatayu Earth's Center (Jatayu Rock),Kollam,Kerala,"Visit the world's largest bird statue, dedicated to the mythical Jatayu, who sacrificed his life attempting to rescue Sita. The statue uniquely depicts a missing wing, symbolizing his injury and the profound sacrifice.",Cultural/Historic Site,,Moderate,Kollam,3
900-year-old Monastery,Ladakh,Ladakh,"Experience a unique overnight stay and dinner with monks in an ancient 900-year-old monastery, accessible via a 2.5-hour scenic hike. This exclusive experience is not typically available to tourists.",Cultural/Historic Site,,Moderate,Ladakh,6
Stag Beetle Discovery in Sikkim,,Sikkim,"Experience the thrill of unexpected wildlife encounters, where you might stumble upon rare and valuable species like the world's most expensive Stag Beetle, revealing a unique and surprising aspect of Sikkim's natural environment.",Activity,,Free,Sikkim,7
Roadside Dhaba (Unspecified Location),Unspecified,Unspecified,"An authentic roadside eatery offering a real glimpse into local interactions and conditions, providing travelers with unique, unfiltered insights into the regional environment, even if the information received is cautionary.",Food Joint,Evening,Budget-friendly,Guwahati,2
Remote Routes of Mon District,Mon,Nagaland,"Explore challenging and lesser-known routes where few travelers venture, offering a rugged and authentic journey through untouched landscapes.",Activity,,Budget-friendly,Mon,9
Loktak Lake & Keibul Lamjao National Park,,Manipur,"A breathtakingly beautiful lake in Manipur which hosts Keibul Lamjao National Park within its waters, where visitors can experience staying in charming floating huts.",Natural Landmark,,Moderate,Imphal,7
Remote Mountain Temple,,,"A secluded Hindu temple in a mountainous region, providing shelter during extreme weather conditions. It offers a raw and unforgettable experience, characterized by its isolation and the profound memories it creates during challenging journeys.",Cultural/Historic Site,,Free,Mountainous Region,4
Manikarnika Ghat,Varanasi,Uttar Pradesh,"Experience the profound cycle of life and death by witnessing the continuous sacred fire of pyres, a tradition maintained for thousands of years, which inspires deep philosophical contemplation about human existence.",Cultural/Historic Site,,Free,Varanasi,3
Village with Waste-to-Manure System,,,"Discover a village where residents demonstrate an innovative and authentic waste management system, utilizing 'Android toilets' to convert human waste into manure for farming, highlighting a truly sustainable and self-sufficient way of life integral to the community.",Cultural/Historic Site,,,,3
Zulfon Peak/Viewpoint,,,"Undertake a challenging 5-hour trek to reach Zulfon and be rewarded with an overwhelming and stunning natural beauty, an especially enjoyable experience during the rainy season.",Natural Landmark,Rainy season,Budget-friendly,,6
Kamakura,Kamakura,Kanagawa,"Escape Tokyo's hustle and bustle for an authentic glimpse into the Japan depicted in films and anime, highlighted by the impressive Great Buddha statue. It offers a more serene and picturesque experience compared to the city.",Cultural/Historic Site,,Moderate,Tokyo,6
Shri Malya Vanta Raghunath Temple,Vijayanagara,Karnataka,"Experience profound peace and divinity at this temple where Lord Rama meditated, featuring continuous bhajans 24/7. Discover a stunning sunrise point just a short climb away, offering breathtaking views.",Cultural/Historic Site,Early morning (5 AM) for bhajans and sunrise.,Free,Hampi,6
Film and Television Institute of India (FTII) Campus,Kothrud,Maharashtra,"Explore the historic campus of one of the world's premier film schools, a hub of creativity and learning that has shaped many film professionals. It's described as a place of deep personal significance and high creative energy.",Cultural/Historic Site,,Moderate,Pune,0
Student Film Screenings at FTII,Kothrud,Maharashtra,"Witness the exceptional talent of emerging filmmakers at one of the world's top film institutes. The quality of the films is highly praised, described as 'really good,' offering a unique glimpse into future cinematic trends.",Event/Festival,Evening,Budget-friendly,Pune,6
Mahabodhi Temple Complex & Bodhi Tree,Gaya,Bihar,"Discover profound peace and spiritual divinity at this sacred site where Mahatma Buddha attained enlightenment. The atmosphere under the ancient Bodhi Tree is so serene, you'll find yourself wanting to simply sit and meditate for hours, an unexpectedly moving experience.",Cultural/Historic Site,,Budget-friendly,Bodh Gaya,6
Unexplored Region of Kargil,Kargil,Ladakh,"This part of Kargil offers a unique and previously unseen perspective, promising an enjoyable and less-traveled experience for visitors.",Cultural/Historic Site,,Budget-friendly,Kargil,5
Marble Waste Ground (मार्बल वेज ग्राउंड),Kishangarh,Rajasthan,"A unique, man-made landscape created from marble waste, often appearing visually striking in photographs, resembling a snowy terrain, and featuring a lake with boating activities.",Natural Landmark,,Budget-friendly,Jaipur,0
Snow Leopard Village,Kargil,Ladakh,"A tranquil and deeply immersive village that offers a profound sense of connection, leaving visitors feeling as though they've been there for months, even after a short stay.",Natural Landmark,,Moderate,Kargil,6
Local Momo Making Experience,Kargil,Ladakh,"An engaging hands-on activity where you learn the intricate and artistic craft of preparing perfect momos from a local expert, revealing the hidden skill behind the popular dish.",Activity,,Budget-friendly,Kargil,6
Dual-Ceremony Wedding Celebration,,,"Experience a beautiful and unique wedding celebration that combines ceremonies held in both a church and a temple, featuring vibrant baraat processions, traditional dances practiced over a 121-day road trip, and playful rituals like 'juta churai'. The event is described as nothing short of a fairy tale, filled with joy and love.",Event/Festival,,Budget-friendly,,6
Sunderman (Ghost Village),Kargil,Ladakh,"An abandoned historical village near the Line of Control, which was once part of Pakistan and became Indian territory after the 1971 war. It houses two Museums of Memories preserving artifacts from that period, offering a compelling glimpse into the region's past.",Cultural/Historic Site,,Budget-friendly,Kargil,3
Longlaung Stone Bridge,,Nagaland,"An ancient, unique stone bridge that is a hidden treasure within the Naga Hills. Visitors experience a scenic, remote hike through untouched villages, offering authentic local hospitality on the way to this historic site.",Cultural/Historic Site,,Free,Longfom Village,7
Delhi to Leh HRTC Local Bus Journey,Multiple,"Delhi, Himachal Pradesh, Ladakh","Embark on an intense and unforgettable 36-hour HRTC local bus journey from Delhi to Leh, traversing the iconic Leh-Manali Highway for an authentic and extreme travel experience.",Activity,June to mid-September,Budget-friendly,Delhi,7
Remote Indian Village,,,"Experience deep cultural immersion and genuine local hospitality in a remote village, where friendly villagers welcome visitors into their homes, offering an authentic and unforgettable experience far from mainstream tourist routes.",Activity,,Budget-friendly,Delhi,7
Dras,Kargil,Ladakh,"Visit Dras, recognized as the world's second coldest inhabited place and the primary battleground of the Kargil War. Experiencing its high-altitude, harsh conditions firsthand offers a unique understanding of the immense difficulty and bravery of the soldiers involved in Operation Vijay.",Cultural/Historic Site,,Moderate,Kargil,3
Evening Music Session at a small Dhaba near Kargil War Memorial,Kargil,Ladakh,"Enjoy a beautiful and authentic evening music session at a small dhaba situated directly opposite the Kargil War Memorial, an informal gathering where soldiers sometimes join, creating a memorable local interaction.",Activity,Evening,Budget-friendly,"Kargil War Memorial, Dras",4
Chirai Beach,Diu,Daman and Diu,"An adventurous destination accessible by crossing the sea with your vehicle, it offers scenic drives with water on both sides of the road, leading to beautiful sunset views over the ocean.",Natural Landmark,Evening,Free,Diu,4
Hostel Skill-Exchange Stay,Not Specified,Not Specified,"Experience a unique and budget-friendly way to travel by exchanging your skills, such as photography, for free accommodation at a hostel. It offers an authentic immersion experience.",Activity,,Budget-friendly,Any major city with hostels,6
Rose Festival,,,"An engaging festival where one can volunteer in shops, enjoy diverse stalls, and attend evening concerts while indulging in treats like candy floss. It's a place for unexpected connections.",Event/Festival,Evening,Budget-friendly,,3
Unspecified Beautiful Spot in Nagaland,,Nagaland,"A stunning destination accessible via a challenging 12-hour road journey, promising to reveal the untouched beauty of Nagaland.",Natural Landmark,,Moderate,Nagaland,9
Alleppey's Backwaters (Public Ferry),Alappuzha,Kerala,"Experience the serene backwaters of Alleppey through an affordable and authentic public ferry ride, offering a unique perspective compared to the more expensive private options.",Natural Landmark,,Budget-friendly,Alleppey,6
Backwater Tea Experience,Alappuzha,Kerala,"Enjoy a uniquely refreshing tea experience by standing surrounded by water within the tranquil backwaters, creating a distinct and memorable moment.",Activity,,Budget-friendly,Alleppey,3
Dharamshala and Gurudwara Network for Budget Travel,,India,"Utilizing the widespread network of Dharamshalas and Gurudwaras provides an incredibly affordable and authentic way to travel across India, offering free or very low-cost accommodation and a chance to experience local hospitality.",Activity,,Free,India,7
Hampi Sunsets,Vijayanagara,Karnataka,"Witness breathtaking and tranquil sunsets that are deemed incredibly difficult to surpass, even compared to those at popular sea or Himalayan locations. The experience is enhanced by the timeless ambiance of ancient ruins.",Activity,In the right season,Free,Bangalore,7
Japan's Largest Electronic Store,Tokyo,,"A veritable heaven for tech and anime enthusiasts, this massive store boasts an extensive collection of cool gadgets and anime merchandise, offering surprising deals and a deeply satisfying experience for its target audience.",Activity,,Moderate,Tokyo,6
Hilltop Sunset Viewpoint (Udaipur),Udaipur,Rajasthan,"A specific hilltop location near Udaipur that offers an exceptionally beautiful sunset experience, considered 'one of the best sunsets' by the narrator, accessible after a short drive and a moderate 15-minute hike.",Natural Landmark,Sunset,Free,Udaipur,7
Ziro Valley,Lower Subansiri,Arunachal Pradesh,"A naturally beautiful region, perceived as a 'lovely place' just by its name. The speaker's lack of other specific reasons to visit, beyond its famous music festival, implies it's not a widely known general tourist destination.",Natural Landmark,,Budget-friendly,Ziro,3
Ziro Music Festival,Lower Subansiri,Arunachal Pradesh,"An 'excellent music festival in India' that serves as the singular, compelling reason for the speaker to undertake a challenging journey to Ziro. While 'very good,' its location in a less-mainstream area suggests a unique, off-the-beaten-path experience.",Event/Festival,,Moderate,Ziro,3
The Cave,,,"Features perfect light falling on meditation spots through a hole in the hill, creating a stunning scene reminiscent of a movie.",Cultural/Historic Site,,,Shiv Aapke W,6
Ladakh Winter Adventure (Frozen River Trek),Leh,Ladakh,"Embark on an extreme adventure walking on frozen rivers and embracing the biting cold of Ladakh in its peak winter, a thrilling challenge for those who seek unique experiences and enjoy pushing their limits.",Activity,Peak Winter,Moderate,Delhi,6
