name,district,state,description,category,best_time_to_visit,estimated_cost,anchor_location,underrated_score
Mon,Mon,Nagaland,"The journey to Mon offers an authentic experience, marked by the challenge of securing a bus ticket that isn't readily available and the profound hospitality of the local people in Nagaland.",Cultural/Historic Site,,Budget-friendly,Nagaland,3
Gurdwara Taland Sahib (Accommodation & Langar Experience),Not specified,Punjab,"Experience free community accommodation and Langar (communal meal), offering a peaceful and authentic cultural immersion into Sikh hospitality, witnessing early morning prayers.",Cultural/Historic Site,Early morning to observe prayers; any time for community meals and stay.,Free,"Ludhiana, Punjab",3
Learn Lab in Fatehpur Village,Not specified,Punjab,"Engage with local children learning 21st-century skills and spoken English in a unique community-driven educational initiative, offering a deep dive into rural Punjabi life and culture.",Cultural/Historic Site,After school hours when children are present.,Free,"Ludhiana, Punjab",6
Rural Football Training & Culture Revival,Not specified,Punjab,"Witness or participate in the passionate revival of football in rural Punjab, where dedicated coaches train children and adults across various age groups, promoting fitness and sportsmanship early mornings, offering a refreshing alternative to mainstream sports.",Activity,Early mornings (around 5:30 AM for practice sessions).,Free,"Chakmafi Village, Punjab",7
An Ashram (on the road),,,"Experience selfless hospitality and find free, simple meals (like potato, sago, and halwa) in a spiritual atmosphere, amidst the chanting of Ram's name. It offers a unique insight into India's cultural ethos of feeding travelers.",Cultural/Historic Site,,Free,,4
Cycling in Tokyo,Tokyo,Tokyo Prefecture,"Experience the exceptionally organized and safe cycling culture of Tokyo, featuring dedicated lanes and courteous locals who prioritize cyclists. It offers a peaceful and effective way to explore the city, distinguishing it from typical tourist transportation.",Activity,,Budget-friendly,Tokyo,3
World's Largest Uniqlo,Tokyo,Tokyo Prefecture,"Explore a massive 12-floor Uniqlo store, offering an extensive range of apparel. It's a unique shopping destination due to its unparalleled size and the potential for significantly lower prices compared to other countries.",Activity,,Moderate,Tokyo,0
Small Village in Madhya Pradesh,,Madhya Pradesh,"Experience profound human connection and warmth, where locals welcome you like family, offering a unique insight into the heart of India.",Cultural/Historic Site,,Budget-friendly,Madhya Pradesh,4
Trekking from Manali to Ladakh via Five High Himalayan Passes,Manali,Himachal Pradesh,"Embark on a challenging 10-12 day pedestrian journey across five high Himalayan passes, an arduous adventure designed for personal transformation.",Activity,,Moderate,Manali,1
Pura Town and Garo Tribal Villages,Garo Hills,Meghalaya,"Discover the very unique culture of the Garo tribe in this remote area, where inhabitants live in traditional raised bamboo huts and worship nature, offering an authentic and profound cultural experience away from typical tourist trails.",Cultural/Historic Site,,Budget-friendly,Shillong,7
Irani Cafes,Mumbai,Maharashtra,"These traditional establishments offer a unique cultural experience, deeply rooted in Mumbai's history, making the speaker want to extend his stay due to his fondness for them.",Food Joint,,Budget-friendly,Mumbai,3
Frozen Waterfall on Chadar Trek,Leh District,Ladakh,"A breathtaking 100-foot-tall waterfall completely frozen due to extreme temperatures, creating a real-life Narnia-like spectacle during the challenging Chadar Trek.",Natural Landmark,Winter months (January-February),Free,Leh,7
Mama's Chicken Shop,Safdarjung,Delhi,"Visit for the best chicken in Delhi, offering an incredibly delicious and satisfying meal at an affordable price of just ₹50 per plate.",Food Joint,,Budget-friendly,Delhi,3
Slow Living Road Trip (Udupi to Jabalpur Route),Udupi,Karnataka,"Embrace the joy of an extended road trip focused on slow living. Discover beautiful sunsets and find contentment in the journey itself, a refreshing alternative to hurried travel.",Activity,,Moderate,Udupi,6
Mata Ji's Jungle Hermitage (Kutiya),Uttarkashi,Uttarakhand,"Discover a profoundly authentic spiritual experience at a unique rock shelter hermitage located deep in the jungle near Gangotri. It houses 108 idols of Lord Hanuman and offers a warm, familial connection with the resident ascetic, Mata Ji, in an unforgettable setting unlike any other.",Cultural/Historic Site,,Free,Gangotri,7
Desolate Village Hotel Experience (100-year-old Japanese House),Unnamed Village,Hiroshima Prefecture,"An unconventional and heartwarming stay in a 100-year-old renovated Japanese house, part of a unique village concept where the entire locality functions as a hotel. It offers a warm, homely, and authentic experience away from typical tourist crowds, with a unique check-in process including selecting a book from a library.",Cultural/Historic Site,,Budget-friendly,Hiroshima,7
Orazaki Coast,Unnamed Village,Hiroshima Prefecture,"A pristine, non-touristy coastal area perfect for witnessing a beautiful sunset and experiencing local life, far from the usual tourist spots. It offers a peaceful atmosphere where you can feel truly immersed in a different side of Japan, away from English-speaking crowds.",Natural Landmark,Sunset,Free,Hiroshima,7
Tea Leaf Foraging Hike,Unnamed Village,Hiroshima Prefecture,"A unique morning activity offered as part of the local hostel experience, involving a hike in the local countryside to collect tea leaves. It provides an authentic connection to nature and a glimpse into traditional local customs.",Activity,Morning,Budget-friendly,Hiroshima,3
Hornbill Festival,Kohima District,Nagaland,"Experience an unparalleled cultural immersion where all Naga tribes converge annually to showcase their vibrant traditions, colorful attire, lively performances, and a rich array of local delicacies like bamboo tea and rice beer. The festival truly comes alive with captivating music events as the sun sets, creating an atmosphere of profound joy and cultural pride.",Event/Festival,December 1st to 10th,Moderate,"Kohima, Nagaland",7
"Grace Academy, Sargam Village",Geyzing,Sikkim,"An educational institution (Nursery to Class 5) operating in a remote, small village, run with immense passion by teachers and a principal who uses personal funds. It provides essential education to children in a resource-constrained environment, lacking digital labs, proper play areas, and adequate lighting, yet fosters a strong love for learning among students. It represents an impactful opportunity for support and community development.",Cultural/Historic Site,,Free,"Pelling, Sikkim",7
Sanflower Kurenai Ferry,Fukuoka,Japan,"Experience a luxurious overnight ferry journey connecting Fukuoka to Oita, featuring private balconies, a convenience store, a restaurant buffet, a public bath, and a comfortable lounge. It offers surprisingly opulent amenities and a time-saving, punctual alternative to train travel, providing scenic views across the Japanese sea.",Activity,Overnight (departs 7 PM),Moderate,Fukuoka,7
Varkala Backside Beaches,Thiruvananthapuram,Kerala,"These less-visited beaches offer a tranquil escape from the main tourist areas of Varkala, perfect for exploring and enjoying activities like surfing away from the crowds.",Natural Landmark,,Budget-friendly,Varkala,6
Kaveri Padyatra,,,"A unique walking journey along the Kaveri River, offering a chance for slow travel, introspection, and connecting with local life and nature.",Activity,,Budget-friendly,Along Kaveri River,3
Village Eatery,,,"Experience authentic, budget-friendly village hospitality with a full meal for just Rs. 35, where people offer food with genuine love and care, focusing on community over commercial gain.",Food Joint,Lunchtime,Budget-friendly,Villages along Kaveri River,3
Kala Jadu Camping Spot,,,"A serene and safe spot by the Kaveri River perfect for camping, offering a peaceful overnight stay amidst nature, chosen over traditional accommodations.",Activity,Evening/Night,Free,"Kala Jadu, along Kaveri River",3
Secret Viewpoint of Taj Mahal,Agra,Uttar Pradesh,"Discover an alternative, less-known vantage point that offers a stunning and arguably 'best' view of the Taj Mahal, particularly at sunrise, perfect for those seeking a unique perspective outside the main monument.",Activity,Sunrise,Free,"Taj Mahal, Agra",4
Lal Taj (Hessing's Tomb),Agra,Uttar Pradesh,"Explore a beautiful and photogenic historical site, known as Lal Taj or Hessing's Tomb, which is often overlooked by tourists but offers a unique glimpse into Agra's heritage beyond the main attractions.",Cultural/Historic Site,,Free,Agra,9
Raja Ji National Park (Night Walk Experience),"Haridwar, Dehradun",Uttarakhand,"Offers an intensely unique and profound experience, walking through dense forests at night under moonlight, revealing a raw and primal connection with nature. The narrator described this as a 'deeply shocking experience' unlike anything he has encountered in his life.",Natural Landmark,Night (for the unique experience described),Budget-friendly,"Rishikesh, Haridwar",7
Hundred Days of Journey (100 Days of Journey),Multiple,Across India,"A personal, 100-day quest to fully experience life by leaving Delhi and exploring, driven by the philosophy that life itself is the goal. This transformative journey is a long-held dream, something the narrator truly wants to experience, even without documenting it.",Activity,N/A,Moderate,Delhi (starting point),3
Amarkantak,Anuppur,Madhya Pradesh,"A revered pilgrimage site marking the sacred origin of the Narmada River, offering a tranquil and profound spiritual experience amidst natural beauty.",Cultural/Historic Site,,Budget-friendly,Amarkantak,3
Narmada Jayanti Bhandara,Anuppur,Madhya Pradesh,"An authentic community feast celebrated at the Narmada Temple, offering a unique opportunity to partake in local festivities and experience the spiritual significance of Narmada Jayanti.",Event/Festival,During Narmada Jayanti (typically January/February),Free,Amarkantak,3
Pandav Nritya Festival,Uttarkashi,Uttarakhand,"Experience a unique three-day village festival near Gangotri, where ancient rituals are performed, notably using pumpkin goats instead of live animal sacrifices. This celebration offers a rare glimpse into authentic local traditions with very few tourists present.",Event/Festival,,Budget-friendly,Gangotri,7
Gangotri (Extreme Winter Visit),Uttarkashi,Uttarakhand,"Embark on a unique and challenging spiritual journey to the sacred Gangotri temple amidst extreme winter conditions (around -15°C). This less-traveled experience, requiring specialized transport with snow chains, offers a deeply memorable adventure and a profound connection to the revered site.",Cultural/Historic Site,"Winter (specifically, extreme cold conditions)",Moderate,Uttarakhand Himalayas,5
Jhaal Sa,,,"A highly anticipated and favorite local snack, it serves as a playful personal reward and emotional anchor for the speaker, highlighting the cultural significance of food in daily life and offering a unique, authentic experience.",Food Joint,,Budget-friendly,,3
Ashram (along Narmada River),Khargone,Madhya Pradesh,"A large, peaceful spiritual retreat located along the Narmada River, offering free accommodation, food, and a chance for solitary bathing or swimming in the river, especially during early mornings before crowds gather.",Cultural/Historic Site,"Early morning for a peaceful experience, or colder seasons for the Narmada Parikrama.",Budget-friendly,Maheshwar,3
Narmada Parikrama,Khargone,Madhya Pradesh,"A significant spiritual journey involving walking the entire circumference of the Narmada River, offering an unparalleled opportunity for self-discovery, connecting with nature, and experiencing the incredible hospitality and wisdom of local communities, often without needing money. It's considered by some to be the 'biggest trip in the world' yet unknown in big cities.",Activity,"Colder seasons, particularly winter.",Free,Omkareshwar,7
Gufa Temple (Cave Temple),Khargone,Madhya Pradesh,"A truly unique and awe-inspiring temple built within a complex of natural caves, offering a raw and less-explored spiritual experience. Its 'dangerous' and untouched feel, combined with the extreme scarcity of visitors, makes it a hidden gem that the narrator had never seen before.",Cultural/Historic Site,,Free,Maheshwar,9
Ranjit Singh Dam Reservoir,Pathankot,Punjab,"An incredibly beautiful dam with an amazing backwater reservoir, ideal for a unique camping experience.",Natural Landmark,Night,Budget-friendly,Pathankot,4
Highway-side Dhaba & Camping Spot,Udhampur,Jammu and Kashmir,"An unexpectedly discovered, random spot along the highway offering an amazing sunset view and a chance for an authentic overnight stay and cultural immersion with a local dhaba owner.",Activity,Sunset/Night,Free,Udhampur,6
Mountain Road,,,"Experience a profoundly special and unique moment while driving on a rugged, rocky mountain road. Despite not being conventionally picturesque, the journey itself offers a deep, personal connection and makes the moment feel extraordinary.",Activity,,Budget-friendly,,6
Hornbill Festival,,Nagaland,A grand annual 'Festival of Festivals' where all tribes of Nagaland unite to celebrate and showcase their rich cultural heritage.,Event/Festival,"Annually, for 21 days",Moderate,Nagaland,0
Mount Japfü,Kohima,Nagaland,"Nagaland's second-highest peak, known for its challenging 'monster climber' ascent with almost 90-degree climbs at certain points, offering a magnificent sunrise view from the summit.",Natural Landmark,Start climbing at midnight to reach the peak by sunrise.,Budget-friendly,"Kohima, Nagaland",3
Nagaland,Various districts,Nagaland,"Discover one of India's most raw and untouched beautiful places. If you give it an open-hearted chance, you will fall in love with the state and its people.",Natural Landmark,,Moderate,Kohima,6
Janghai's Village,Not specified,Nagaland,"A remote village located in the Eastern side of Nagaland, accessible through extremely beautiful yet challenging roads where paved paths become scarce. It promises a truly authentic and untouched experience, fulfilling a craving for real, non-mainstream adventures.",Cultural/Historic Site,,Budget-friendly,Kohima,6
Chikmagalur,Chikmagalur,Karnataka,"Known as the Coffee Capital of India, this region offers an incredibly amazing experience with its dreamy, misty landscapes, scenic drives through clouds, unexpected epic views, and a feeling of being in an untouched, serene natural paradise. It's a place that continually surprises visitors with its beauty, reminiscent of Kashmir or the Andaman Nicobar Islands.",Natural Landmark,"When the weather is cool and misty, perfect for driving through clouds and enjoying the cold air.",Budget-friendly,Mangalore,7
Panduranga Coffee,Chikmagalur,Karnataka,"An iconic local coffee shop providing an immersive and educational experience where visitors can learn about the entire coffee process, from its discovery to harvesting, roasting, and different types of coffee, making it ideal for coffee enthusiasts.",Food Joint,Daytime business hours,Budget-friendly,Chikmagalur,2
Chikmagalur Coffee Plantations,Chikmagalur,Karnataka,"Explore vast, lush coffee plantations, offering 'Munnar vibes' with their greenery and cool, refreshing air. Visitors can witness coffee beans growing on trees alongside pepper plants, gaining insight into the cultivation process in an incredibly amazing natural setting.",Natural Landmark,"When the weather is cool and windy, ideal for walking through the green landscapes.",Free,Chikmagalur,6
Unnamed Waterfall,Chikmagalur,Karnataka,"A picturesque waterfall found amidst the scenic beauty of Chikmagalur. When combined with the misty weather, fog, and high altitude, it creates a mesmerizing and serene natural spectacle that requires a unique perspective to fully appreciate its subtle charm.",Natural Landmark,During misty and foggy weather conditions to enhance the visual experience.,Free,Chikmagalur,4
Unnamed Lake,Chikmagalur,Karnataka,"A tranquil lake, often shrouded in fog, adding a mysterious and serene element to Chikmagalur's natural landscape. Its low visibility contributes to its untouched and peaceful ambiance, forming part of the region's epic views.",Natural Landmark,"During foggy conditions to experience its unique, mysterious atmosphere.",Free,Chikmagalur,4
Gustor Spituk Gustor Festival,Leh,Ladakh,"Witness an incredible display of cultural diversity where hundreds gather, including international tourists, to see monks in large, traditional masks perform the captivating 'Chham' dance to authentic Ladakhi music. This festival offers a deep dive into the region's spiritual and cultural heritage.",Event/Festival,,Free,Leh,9
Turuk Village,Leh,Ladakh,"A unique village that stands out from the rest of Ladakh due to its distinct people, language, and landscape. Historically significant, it became part of India after the 1971 war, offering a beautiful natural setting with rivers and waterfalls.",Cultural/Historic Site,August (for local celebrations),Budget-friendly,"Leh, Ladakh",8
50 Years of Independence Festival,Leh,Ladakh,"A grand and colorful regional festival, much larger than anticipated, celebrating the 50th anniversary of Turuk and five other border villages becoming part of India. It features diverse cultural performances by 150 artists from across India.",Event/Festival,August (around India's Independence Day),Free,"Turuk Village, Ladakh",7
Turtuk - India's Last Village (Zero Point),Leh,Ladakh,"This is India's final village before the Pakistan border, offering a unique opportunity to view Pakistan with the naked eye from its 'zero point'. It's a significant and remote location known for its strategic importance and unique border experience.",Cultural/Historic Site,August (for local celebrations),Free,"Leh, Ladakh",8
Coastal Bicycle Journey from Kochi to Kanyakumari,Ernakulam,Kerala,"Embark on an adventurous and unique bicycle journey from Kochi, following the scenic coastal route all the way to Kanyakumari, promising a 'cool' and 'crazy' way to experience Southern India.",Activity,,Budget-friendly,Kochi,3
Interactive Dart Game with Locals,Ernakulam,Kerala,"Engage in an impromptu dart game with locals at Fort Kochi, fostering social interaction, personal growth, and creating a lively, 'fullsome' atmosphere with music and shared fun.",Activity,Evening,Budget-friendly,Fort Kochi,3
The Distinct Character of Kerala's Local Buses and Culture,,Kerala,"Experience the unique charm of Kerala's local buses, often without traditional windows, and immerse yourself in the vibrant, 'loud, colorful, and free' local culture, complemented by incredible food and music, which the traveler affectionately calls 'South India's Punjab'.",Cultural/Historic Site,,Budget-friendly,Kochi,4
Bithoor,Kanpur Nagar,Uttar Pradesh,"A profoundly significant pilgrimage site in Hinduism and history, Bithoor is home to Brahmavart Ghat (believed to be where Lord Brahma created the universe), the birthplace of Lord Rama's sons Lava and Kusha (featuring a unique Mother Janki temple without Lord Rama), and Maharishi Valmiki's Ashram where the Ramayana was written, complete with an ancient, self-renewing tree and Sita's kitchen. It also holds historical importance as the starting point of the 1857 Revolt. Despite its immense heritage, Bithoor is visibly neglected, offering a raw, authentic, and deeply spiritual experience away from mainstream tourist crowds.",Cultural/Historic Site,,Budget-friendly,Kanpur,7
Local Tea Stall in Bithoor,Kanpur Nagar,Uttar Pradesh,"A charming local tea stall in Bithoor that serves as a vital social hub, providing simple, comforting food options like tea, samosas, and pakoras in an area with limited dining choices. Visitors can experience genuine local hospitality and connect with the community through heartfelt interactions, a stark contrast to more commercial establishments.",Food Joint,"Morning (for breakfast), or throughout the day for snacks",Budget-friendly,"Valmiki Ashram, Bithoor",3
Swayamsevi Ganga Suraksha Dal's River Cleaning Activity,Kanpur Nagar,Uttar Pradesh,"A unique, non-governmental volunteer initiative dedicated to selflessly cleaning and protecting the Ganga riverbanks. Encountering members like Muhammad Laal Badshah offers a profound insight into interfaith harmony, environmental dedication, and the raw, unacknowledged efforts of local communities, providing a deeply moving and inspiring experience that is rarely publicized.",Activity,Sunday mornings (at Rani Lakshmi Ghat),Free,"Rani Lakshmi Ghat, Bithoor",4
Gangotri in Winter,Uttarkashi,Uttarakhand,"Experience a challenging yet deeply spiritual journey to the revered pilgrimage site amidst extreme winter temperatures (-15 to -20°C), offering a uniquely serene and less crowded atmosphere.",Cultural/Historic Site,Winter (specifically when temperatures are -15 to -20°C),,Uttarkashi,3
Spiritual Encounter with the Mataji (saintly woman),Uttarkashi,Uttarakhand,"Seek unique spiritual guidance or profound insights from a revered saintly woman in Gangotri, an deeply personal and non-mainstream experience vital for personal growth or creative endeavors like writing a book.",Activity,Winter (implied by the narrator's travel plans),Free,Gangotri,9
Local Dhaba Experience,Not specified,Not specified,"An immersive journey across India, characterized by relying on local kindness and working at roadside dhabas. This offers a unique opportunity to engage with authentic Indian life, culture, and hospitality firsthand, providing a perspective often missed by mainstream tourism and leading to personal, compelling stories.",Activity,,Free,India,3
Savitri Devi Mandir,Ajmer,Rajasthan,"Visit for a fantastic panoramic view, a refreshing breeze, and a spectacular sunset, especially rewarding after making the effort to walk up.",Cultural/Historic Site,Sunset,Budget-friendly,Pushkar,3
Anshul Bhai's Guest House,Leh,Ladakh,"Experience authentic hospitality, with hosts who offer warm greetings and guided village tours. Enjoy delicious, 100% organic meals prepared with fresh vegetables sourced directly from the guest house's own garden.",Food Joint,,Budget-friendly,Leh,4
Hunderman Heritage House and Museum,Leh,Ladakh,"Explore a well-preserved collection showcasing the ingenuity of past generations, including traditional tools and clothing, reflecting the rich history and resourcefulness of this border village.",Cultural/Historic Site,,Budget-friendly,Leh,3
Hunderman's Natural Cold Storage (Bungas),Leh,Ladakh,"Discover an ingenious, age-old underground cold storage system that naturally maintains low temperatures, capable of preserving meat and other perishables for decades without electricity, a testament to traditional innovation and a true mystery.",Cultural/Historic Site,,Free,"Hunderman Village, Leh",7
Chadar Trek (Zanskar River),Leh,Ladakh,"Embark on an adventurous multi-day trek across the frozen Zanskar River, experiencing the unique challenge of walking on an ice sheet during peak winters.",Activity,Peak winters,Moderate,Ladakh,6
Maheshwar Fort (and Ahilyabai Holkar's Residence),Khargone,Madhya Pradesh,"A historically significant fort and the residence of Ahilyabai Holkar, known for its beautiful architecture and its strategic location right on the banks of the Narmada River. It offers insights into Ahilyabai's extensive work in renovating major Hindu temples across India.",Cultural/Historic Site,,Moderate,Indore,6
Kaleshwar Mandir,Khargone,Madhya Pradesh,"A temple uniquely situated by the significantly wide and vast Narmada River, offering a picturesque and peaceful spiritual experience amidst natural beauty.",Cultural/Historic Site,,Free,Maheshwar,3
Maheshwar's Filming Locations (aka 'Movies' Banaras'),Khargone,Madhya Pradesh,"Explore the specific ghats and areas within Maheshwar that have served as popular filming locations, often depicted as 'Banaras' in major Bollywood movies like Yamla Pagla Deewana, Padman, Genius, and Dabangg.",Activity,,Budget-friendly,Maheshwar,7
Kachori at Rajkumar Hotel,Khargone,Madhya Pradesh,"Indulge in an exceptionally delicious and highly recommended kachori from a local hotel, found in Srinagar near Nag Mandir, between Barwaha and Dhamnod. Its taste is so remarkable that visitors are challenged to find it anything less than amazing.",Food Joint,,Budget-friendly,Srinagar (near Nag Mandir),9
HRTC Bus Journey from Delhi to Leh,"Delhi, Leh","Delhi, Himachal Pradesh, Ladakh","An adventurous 1000 km journey across four high Himalayan mountain passes, offering an authentic, local, and budget-friendly alternative to flying, allowing travelers to witness stunning landscapes and interact with diverse co-passengers.",Activity,During the operating season,Budget-friendly,Delhi,6
Gata Loops,Leh,Ladakh,"A series of 21 hairpin bends infamous for a local legend about a truck conductor's ghost, where travelers leave water bottles at a small shrine to appease his spirit, offering a unique blend of natural beauty and local folklore.",Cultural/Historic Site,,Free,Pang,3
More Plains,Leh,Ladakh,"A vast, incredibly beautiful, and surreal high-altitude flatland, offering breathtaking vistas that create a truly unforgettable visual experience, highly anticipated by travelers.",Natural Landmark,,Free,Tanglang La,3
