name,district,state,description,category,best_time_to_visit,estimated_cost,anchor_location,underrated_score
Dawn Homestay,,Nagaland,"This homestay offers a unique, deeply personal experience, fostering a home-like atmosphere and a sense of family among guests. Visitors can enjoy authentic cultural immersion through activities like shared cooking (e.g., dosa, shark sukha) and engaging storytelling around a fire, providing peaceful moments often overlooked by mainstream tourism.",Activity,,Budget-friendly,Dzukou Valley,7
Christmas Celebration in a Naga Village Church,Kohima District,Nagaland,"Experience an authentic and local Christmas celebration featuring vibrant singing, dancing, and a communal feast shared with villagers, offering a genuine cultural immersion far from mainstream festivities.",Event/Festival,Christmas season,Free,Kohima,6
Japanese-style Starbucks,,Japan,"Experience a unique Starbucks where you can enjoy coffee while sitting on traditional tatami mats on the ground, offering an authentic Japanese twist to a global coffee experience.",Food Joint,,Moderate,Japan,3
Mount Fuji's Undiscovered Viewpoints,Mount Fuji Area,"Yamanashi / Shizuoka Prefectures, Japan","Discover unique, less-known vantage points offering unparalleled views of Mount Fuji, promising a sight unlike anything typically experienced by tourists, especially when popular spots fail to deliver a clear view.",Natural Landmark,,Budget-friendly,Mount Fuji,8
Japan's Highest National Road,,Japan,"Experience breathtaking panoramic views of majestic mountains, often above the clouds, providing an unparalleled sunset spectacle from high altitude.",Natural Landmark,Sunset,Budget-friendly,Japanese Alps,3
Juari Valley,,Goa,"This captivating valley, previously unknown to the speaker, was discovered through an internet picture. Its scenic beauty compelled an immediate visit, offering a unique trekking experience along its natural paths.",Natural Landmark,,Budget-friendly,Panaji,6
Mystery Prize Vending Machine,,,"Discover a unique vending machine experience in Japan, where for 1000 JPY, you can try your luck at winning a random prize, ranging from an iPhone to a digital watch, offering a fun and unpredictable thrill.",Activity,,Moderate,Japan,3
Longwa Village,Mon,Nagaland,"Experience a truly unique cultural immersion in this border village where the international boundary between India and Myanmar remarkably passes through the local King's house. Engage with warm, hospitable locals and witness a rare geographical phenomenon firsthand.",Cultural/Historic Site,,Budget-friendly,"Mon, Nagaland",6
Majuli,Majuli,Assam,"An idyllic and peaceful river island, offering lush greenery and serene beauty reminiscent of ancient, pristine villages. It provides a unique escape into nature and local culture.",Natural Landmark,,Budget-friendly,Assam,4
Off-trail Kyoto Viewpoint near Fushimi Inari,Kyoto,Kyoto Prefecture,"Discover an authentic and beautiful panoramic view of Kyoto by venturing off the well-trodden paths around the famous Torii gates, offering a peaceful and scenic alternative to the main temple trail.",Natural Landmark,,Free,Fushimi Inari Taisha,4
Nara Park,Nara,Nara Prefecture,"Encounter wild deer that roam freely and even politely bow for rice crackers, creating a heavenly and dreamlike experience, especially enchanting during the golden evening light.",Natural Landmark,Evening (golden light),Budget-friendly,Nara,6
Night Carnival,Kohima,Nagaland,"A surprisingly cool and beautiful kilometer-long night carnival, bustling with food stalls, refreshments, and games, offering an unexpected and vibrant experience in Nagaland.",Event/Festival,Evening,Budget-friendly,Kohima,7
Authentic Nagaland Settlement (implied from 'its free down'),,Nagaland,"An unexpectedly captivating place in Nagaland where the traveler formed strong personal connections, extended their stay from an intended two days to six, and felt no desire to leave, cherishing the authentic experience despite cultural and language barriers.",Cultural Immersion,December,Budget-friendly,Nagaland,6
Shri Vijay Vithala Temple,Vijayanagara,Karnataka,"Visit this temple for its incredible ancient architecture, including the famous musical pillars, and to experience a profound sense of stepping back in time.",Cultural/Historic Site,Early morning,Budget-friendly,Hampi,3
Unique Japanese Sake Bar Alley,Shinjuku,Tokyo Prefecture,"Experience authentic Japanese sake in a uniquely traditional setting, characterized by small, intimate bars tucked away in an alley.",Food Joint,Night,Moderate,"Shinjuku, Tokyo",3
Kaike (Tokyo),Tokyo,Tokyo Prefecture,"Discover a location in Tokyo that offers a profoundly memorable night out, leaving a lasting impression on visitors.",Activity,Night,Moderate,Tokyo,4
Aogashima,Izu Islands,Tokyo Prefecture,"A unique volcanic island, home to a rare volcano-within-a-volcano formation—the only one of its kind globally. Visitors enter through a long tunnel to a 'magical world' where food is cooked using geothermal steam.",Natural Landmark,,Moderate,Tokyo,8
Kamakura Koko-mae Station Railway Crossing,Kamakura,Kanagawa,"This iconic railway crossing, famously depicted in the Slam Dunk anime opening, offers a profoundly satisfying and scenic experience by the sea that evokes strong positive emotions words cannot fully express.",Cultural/Historic Site,,Free,Kamakura,5
Kid Waterfall,,,"Discover this adventurous waterfall that remains hidden until you are very close. Reaching it requires navigating through narrow paths and climbing rocks, offering a unique and rewarding view for those who make the effort.",Natural Landmark,,Free,,8
Rural Mountainous Japan (via Bus Journey),,,"Explore Japan's authentic, less-traveled mountainous regions, offering scenic views and a unique perspective often missed when using high-speed trains. This mode of travel provides a deeper connection with the country's natural landscape.",Activity,,Budget-friendly,Tokyo,6
Baba's Musical Gathering in Leh Market,Leh,Ladakh,"Experience an unparalleled peaceful atmosphere created by Baba's spontaneous guitar music and singing, where people naturally join in, offering a unique and deeply personal highlight.",Activity,Evening,Free,Leh Market,7
Udupi,Udupi,Karnataka,"This coastal city serves as the destination for a unique, two-week road trip from Delhi, transforming a quick journey into a leisurely, exploratory adventure for a friend's wedding. The travel style implies a more immersive and less rushed way to experience distant places.",Cultural/Historic Site,,,Delhi,3
Zanskar's Largest Monastery,Zanskar,Ladakh,Experience breathtakingly beautiful panoramic views after a challenging yet rewarding climb to the top of Zanskar's largest monastery.,Cultural/Historic Site,,Budget-friendly,Zanskar,3
Snow Leopard Sighting/Tracking,Kargil,Ladakh,"Engage in the thrilling and rare opportunity to witness majestic snow leopards in their natural, snowy habitat.",Activity,Winter,Moderate,Kargil,3
Indo-Myanmar Border Village (Ka Ex-am),Not specified,Manipur,"Experience a unique village life where the international border of India and Myanmar literally passes through the middle of the settlement, offering a rare glimpse into cross-border daily routines and local culture amidst a peaceful, less-touristy environment.",Cultural/Historic Site,,Budget-friendly,Indo-Myanmar Border,4
Zanskar Valley,Zanskar,Ladakh,"A truly remote valley in Ladakh, offering an exciting and authentic travel experience away from the usual crowds, promising captivating natural beauty.",Natural Landmark,,Budget-friendly,Kargil,3
Rang-Rum Glacier,Zanskar,Ladakh,"An incredibly massive and awe-inspiring glacier, potentially the second largest in Ladakh after Siachen, stretching 23 kilometers and offering a breathtaking natural spectacle.",Natural Landmark,,Free,Zanskar,6
Suicide Forest of Japan,,Yamanashi Prefecture,"Experience an eerily beautiful forest with uniquely distinct trees, providing a thought-provoking journey into a place with an infamous history. It offers a contrasting beauty against its solemn reputation.",Natural Landmark,,Free,Mount Fuji,3
Chadar Trek,Zanskar,Ladakh,"Walk on a historic 1000-year-old frozen river path, which serves as a vital lifeline for the isolated Zanskar region during winter. It offers a peaceful and authentic journey through a stunning, snowy landscape, with hints of secret spots along the way.",Activity,Winter (when the river is frozen at -15 degrees Celsius),Moderate,Leh,4
Poo Village,Leh District,Ladakh,"A secluded village in Ladakh renowned for offering exceptionally easy sightings of snow leopards, animals notoriously difficult to find in the wild. It attracts many international wildlife enthusiasts for this unique and rare viewing opportunity.",Natural Landmark,,Moderate,Ladakh,6
Singrap Village Viewpoint,Shimla,Himachal Pradesh,"Discover an amazing viewpoint, described as a 'dreamland,' offering a magical sunrise experience that was discovered by chance, making it a truly unique find.",Natural Landmark,Sunrise,Free,Kifri Town,8
Beautiful Sunset in Jaipur,Jaipur,Rajasthan,"Experience a serene evening sunset, a moment described as bringing happiness to everyone present, offering a delightful and memorable end to the day.",Natural Landmark,Evening,Free,Jaipur,2
Chhath Puja,Munger,Bihar,"Experience the deeply spiritual and cultural Chhath Puja festival in an authentic and immersive way by staying with a local family. Enjoy traditional homemade delicacies like Kaddu Bhaat and Thekua, and feel a profound sense of belonging and hospitality amidst a wedding-like atmosphere.",Event/Festival,,Budget-friendly,Munger,6
Casual Manipuri Festival,Imphal,Manipur,"Engage in a local festival to experience Manipur's rich and distinct culture, which stands out as significant compared to other Seven Sisters states.",Event/Festival,,Budget-friendly,Imphal City,4
Local Home-cooked Manipuri Food Experience,Imphal,Manipur,"Savor authentic and very tasty Manipuri cuisine prepared and served in a local home, offering an immersive cultural and culinary journey.",Activity,,Budget-friendly,Imphal City,3
Local Sightseeing in Imphal,Imphal,Manipur,"Discover Imphal City through the unique perspective of a local guide, ensuring an authentic and in-depth exploration beyond typical tourist routes.",Activity,,Budget-friendly,Imphal City,3
Dedicated Bicycle Underpasses,Kyoto City,Kyoto Prefecture,"Experience Japan's exceptionally developed urban cycling infrastructure, featuring dedicated underpasses that highlight a unique and highly organized approach to urban mobility, often overlooked by visitors.",Activity,,Free,Kyoto,6
Gatang Gali,Uttarkashi,Uttarakhand,"Explore this recently reopened 150-year-old historic bridge, which once served as a vital link between Uttarakhand and Tibet and holds significance from the 1962 India-China War.",Cultural/Historic Site,,Budget-friendly,Gangotri,6
Tapovan Art Gallery,Uttarkashi,Uttarakhand,"Delve into the fascinating life and stunning Himalayan photography of Swami Sunderanand Ji, a revered yogi and artist, through his preserved works and personal belongings.",Cultural/Historic Site,,Budget-friendly,Gangotri,3
Gokarna,Uttar Kannada,Karnataka,"Visit Gokarna for its tranquil, less-crowded beaches with available food and drink facilities, offering a peaceful escape from mainstream tourist spots.",Natural Landmark,,Budget-friendly,Goa,4
Balaghat Boat & Music Experience,Balaghat,Madhya Pradesh,"Experience authentic local music on a peaceful boat ride, offering profound tranquility and a serene escape. It brings deep peace to the mind and soul, a stark contrast to noisy, mainstream locations.",Activity,,Budget-friendly,Banaras,3
Japanese Themed Local Train,,,"Embark on a special local train journey in Japan that brings the unique aesthetic of a traditional Japanese room directly into its compartments, providing an immersive and surprising cultural experience without requiring any extra ticket fees beyond the standard fare.",Activity,,Budget-friendly,Japan,6
Dras,Kargil,Ladakh (UT),"Known as India's coldest inhabited place, visitors can experience extreme sub-zero temperatures (around -25°C) and witness the unique phenomenon of water freezing instantly when thrown in the air.",Natural Landmark,Winter (when temperatures are around -25°C),Free,Kargil,1
Hello Kitty Shinkansen,,,"Embark on a unique bullet train journey themed entirely around Hello Kitty, complete with special playing rooms, themed merchandise like candies and toys, and attentive hosts ensuring a delightful experience.",Activity,,Moderate,Japan,3
Kumbh Mela at Sangam,Prayagraj,Uttar Pradesh,"Experience a profound sense of unity and collective energy where millions gather. Despite common negative perceptions about the river's condition, the deep spiritual devotion and communal spirit at the confluence can be transformative, evoking an electrifying feeling that transcends even skeptical views.",Event/Festival,,Free,Prayagraj,6
पाताल गुफा (Patal Gufa),Uttarkashi,Uttarakhand,"An intriguing 12-foot deep cave nestled in a hidden spot amidst dense jungles, requiring a rope to identify the path. It is considered the most interesting among the many caves in the Gangotri region and offers a unique, crazy exploration experience.",Natural Landmark,,Free,Gangotri,9
Unnamed Mountain Lodge on Uttarkashi-Gangotri Route,Uttarkashi,Uttarakhand,"An unexpected, serene stopover in a small mountain lodge due to heavy snowfall, offering an authentic and unique Himalayan experience that transforms initial travel challenges into moments of profound peace and unexpected beauty.",Activity,Winter (specifically during heavy snowfall),Budget-friendly,Uttarkashi,4
Hitchhiking with Kashmiri Truckers,,Jammu and Kashmir,"Experience an authentic and unique journey through the region, encountering unexpected hospitality from local truckers. What might start as a quiet ride can transform into a memorable and delightful interaction, highlighting the genuine warmth of the Kashmiri people.",Activity,,Free,Kashmir Valley,3
Mokokchung Night Market,Mokokchung,Nagaland,"Experience a vibrant, high-energy night market that transforms into a lively football-watching party during major events like FIFA. Roads are closed, a large screen broadcasts matches, and live bands add to the 'crazy atmosphere.' Participate in unique games where you can win local prizes like trays of eggs, chicken, or fish, offering a truly authentic and non-mainstream experience.",Event/Festival,Night (during football events),Budget-friendly,Mokokchung,6
Thiksey Monastery,Leh,Ladakh,"Experience profound tranquility at this majestic monastery, particularly at sunset when the temple lights illuminate the serene Maitreya Buddha, creating a truly memorable and peaceful atmosphere that encourages visitors to linger.",Cultural/Historic Site,Sunset,Budget-friendly,Leh,3
Double Decker Living Root Bridge,East Khasi Hills District,Meghalaya,"Experience a natural wonder where an entire bridge is crafted from living tree roots, which continuously strengthen over time, offering a truly unique and breathtaking natural spectacle, built without any steel.",Natural Landmark,,Budget-friendly,Cherrapunji,6
Local's Secret Viewpoint for Tiger Hill,Dras,Ladakh,"Discover a unique vantage point, revealed by a local, offering the most spectacular and strategic views of Tiger Hill. This spot provides an unparalleled perspective on the historical Kargil War and the immense challenges faced by soldiers.",Natural Landmark,,Free,Dras,5
IRCTC E-catering Service (on Indian Railways),New Jalpaiguri,West Bengal,"Discover the unexpected convenience of having hot, fresh meals like Domino's pizza delivered directly to your train seat, enhancing long journeys with surprising comfort.",Activity,,Budget-friendly,New Jalpaiguri Railway Station,6
Ima Market (Mother's Market),Imphal,Manipur,"Explore the world's largest all-women run market, a vibrant hub where only women manage all operations. Discover a wide array of goods including fresh vegetables, fruits, toys, and spices, offering a truly unique cultural shopping experience.",Cultural/Historic Site,,Budget-friendly,Imphal,4
Muharram Procession,Kargil,Ladakh,"Witness a deeply moving and culturally significant religious procession, offering a profound glimpse into local traditions and community spirit during Muharram, an event often overlooked by mainstream tourism.",Event/Festival,During Muharram (specific date varies annually based on the Islamic calendar),Free,Kargil,4
Local Home Hospitality,Kargil,Ladakh,"Experience the unparalleled warmth and genuine generosity of local residents, including being invited into a home for a homemade meal. This offers an authentic, personal connection to the local way of life, especially valuable when other facilities are closed.",Activity,"Anytime, particularly during local holidays or challenging travel conditions",Free,Kargil,4
Narmada Parikrama,,Madhya Pradesh,"Embark on a profound spiritual journey around the Narmada River, where you can experience unique encounters with human kindness and an authentic connection to local life, far removed from typical tourist experiences. The speaker highlights an unforgettable experience of receiving selfless care during this challenging pilgrimage.",Activity,Early 2023 (implying cooler months like winter/early spring),Budget-friendly,Amarkantak,3
Dimapur Night Market,Dimapur,Nagaland,"Experience a vibrant atmosphere with a variety of games, gambling, and an abundance of food, giving off a lively vibe reminiscent of a smaller version of Thailand's famous markets.",Event/Festival,Night,Budget-friendly,Dimapur,6
Ellora Caves,Aurangabad,Maharashtra,"Witness the awe-inspiring 34 rock-cut caves, a UNESCO World Heritage Site, showcasing ancient Indian architecture with Jain temples, Buddhist monasteries, and the magnificent Kailasa Temple. The grandeur and precision of these thousands-year-old structures, carved from solid rock, are truly remarkable and demonstrate the high level of ancient Indian civilization's wealth and prosperity.",Cultural/Historic Site,,Budget-friendly,Aurangabad,6
Tokyo Skytree,Sumida City,Tokyo Prefecture,"Experience stunning panoramic views of Tokyo from Japan's tallest building, particularly captivating during golden hour when the city's 'concrete jungle' transforms into an unexpectedly beautiful vista, far exceeding initial expectations.",Cultural/Historic Site,Golden Hour,Moderate,Tokyo,6
"Narmada River Ghat, Omkareshwar",Khandwa,Madhya Pradesh,"Experience a profound and serene connection with the Narmada River, where the natural breeze provides immense peace and comfort, offering a spiritual reprieve from everyday life.",Natural Landmark,Night,Free,Omkareshwar,6
Local Sweets and Halwa at Narmada River Bank,Khandwa,Madhya Pradesh,"Discover an unexpected abundance of local sweets and halwa directly by the Narmada river, a simple yet deeply satisfying culinary experience that fulfills hunger and brings joy.",Food Joint,Evening,Budget-friendly,Omkareshwar,6
Overnight Open-Air Stay on Omkareshwar Narmada River Ghat,Khandwa,Madhya Pradesh,"Embrace a unique, free-spirited overnight stay directly on the ghat, where the natural night breeze delivers unmatched comfort and peace, surpassing the luxury of modern air-conditioned rooms.",Activity,Night,Free,Omkareshwar,7
Gomukh,Uttarkashi,Uttarakhand,"A sacred glacial snout, revered as the source of the Bhagirathi River (Ganga). It offers a unique opportunity for a deeply personal and spiritual journey, providing a setting for introspection and profound emotional release amidst majestic natural beauty.",Natural Landmark,,Moderate,Gangotri,3
Solapur,Solapur,Maharashtra,"A city that serves as the backdrop for an unexpected and heartwarming encounter, where a generous local hints at authentic, enjoyable spots on its outskirts, suggesting opportunities for less-touristy exploration.",Activity,,,,3
Narnia-like Winter Wonderland Trek,,,"Embark on a challenging multi-day trek through a pristine, snow-covered landscape that unfolds into a magical winter wonderland, offering breathtaking views so spectacular they evoke the mythical beauty of Narnia.",Natural Landmark,Winter/Snow season,Moderate,,7
Jungle Trek with 3000+ Stairs and Challenging Bridge,,,"Experience an adventurous journey through dense jungles, featuring a challenging bridge crossing and a rigorous climb of over 3000 stairs to exit the wilderness, offering a uniquely authentic and demanding experience.",Activity,,Free,,3
Padum,Zanskar (Kargil),Ladakh,"A remote and authentic high-altitude destination in the Zanskar Valley, offering a tranquil experience away from mainstream tourism. Reaching it involves significant trekking due to limited transport options, allowing for an immersive journey.",Cultural/Historic Site,,Moderate,Zanskar Valley,3
Gangotri,Uttarkashi,Uttarakhand,"A sacred pilgrimage site located at the source of the holy Ganges River, offering unique and time-sensitive photographic opportunities, essential for artistic or literary projects.",Cultural/Historic Site,,Free,Rishikesh,3
Nara Park (Deer Interaction & Cultural Sites),Nara,Nara Prefecture,"Encounter uniquely friendly, bowing deer that roam freely throughout the park, offering a dream-like interaction. The area also holds significant historical value as Japan's first recognized capital and houses UNESCO World Heritage Sites, including ancient temples, making it a culturally rich experience.",Cultural/Historic Site,,Budget-friendly,Nara Station,3
Aoniyoshi Limited Express Train,N/A,Nara and Kyoto Prefectures,"Experience a luxurious and unique train journey, featuring special compartments, comfortable twin seats, and even an onboard bar. This train offers superior amenities and a distinctive travel experience, considered by the speaker to be better than Japan's famous bullet trains.",Activity,,Moderate,"Nara Station, Kyoto Station",7
Mughal Road (Old route out of Srinagar),Kashmir region,Jammu and Kashmir,"Experience an adventurous journey through a less-traveled, single-lane old route, often necessitated by closures on main highways, offering a unique perspective of the region's challenging terrain.",Activity,,Moderate,Srinagar,3
Stone Skimming/Skipping in Kashmir River,Kashmir region,Jammu and Kashmir,"Engage in a simple yet delightful pastime by the rivers of Kashmir, searching for perfectly flat stones to skip across the water, a truly authentic and unscripted local activity.",Activity,,Free,Kashmir,3
Ludhiana Butter Chicken (from Keshav's preferred Dhaba),Ludhiana,Punjab,"Savor what a food enthusiast declares as the best butter chicken, renowned for its unparalleled taste and local authenticity, making it a must-visit culinary spot in Ludhiana.",Food Joint,,Budget-friendly,Ludhiana,6
Isolated Beach in Gujarat,,Gujarat,"A serene and uncrowded beach, perfect for relaxation and enjoying peaceful moments away from the typical tourist spots.",Natural Landmark,,Budget-friendly,Gujarat Coast,9
Back-cutting Adventure Across India,,,"An immersive 100-day journey across India focused on connecting with and appreciating the lives of 12 individuals, offering a unique, non-mainstream travel experience that prioritizes deeper connections over typical tourist routes.",Activity,,Budget-friendly,India,3
Amma Village,,Nagaland,"Experience the authentic charm of Nagaland's second-largest village, Amma, known for its unexpectedly wide roads and the exceptional warmth and generosity of its locals. Visitors will discover significant adventure and heartfelt hospitality by venturing off the typical tourist path.",Cultural/Historic Site,,Budget-friendly,Nagaland,9
Zanskar Valley,Zanskar,Ladakh,"An awe-inspiring region characterized by its dramatic snowy landscapes, unique roadside natural formations, and ancient monasteries. It offers breathtaking views that compel visitors to stop and soak in its beauty, earning it the poetic moniker 'The Land of White Coffee' due to its pristine, snow-covered vistas.",Natural Landmark,Winter,Moderate,Leh,7
Gangotri,Uttarkashi,Uttarakhand,"Experience the spiritual and natural wonder of the Ganga River's origin, a significant pilgrimage site offering a profound journey away from mainstream tourist activities.",Natural Landmark,,Moderate,Rishikesh,3
Isolated Farm Retreat,Rural Hinterlands,Indian Subcontinent,"Discover a truly secluded and non-mainstream escape where conventional transportation is non-existent, offering an adventurous challenge and an immersive experience in the heart of remote rural life, complete with 'non-existent' roads that require resourcefulness and local ingenuity to navigate.",Accommodation,,Budget-friendly,Nearest Rural Taxi Stand,3
Rakhi Wholesale Shop,Mumbai,Maharashtra,"Discover a vast collection of Rakhis with 400-500 diverse designs, offering options from ₹1 to ₹5000. It's an authentic place for bulk purchasing and exploring unique cultural items, especially for those interested in the festival of Raksha Bandhan.",Activity,,Budget-friendly,"Suti Hotel, Bhuleshwar",2
Jaipur Live Event,Jaipur,Rajasthan,An official book launch event for 'Mellowdy of India' where attendees can meet the authors and interact with them during their all-India camper van tour.,Event/Festival,Tomorrow (from the video's perspective),Budget-friendly,Jaipur,0
Hampi,Vijayanagara,Karnataka,"Hampi is a historical and mysterious site, home to the iconic Stone Chariot featured on the 50 Rupee note. It is far more than just ancient ruins; it was once the world's second-largest city during the Vijayanagara Empire, a scale you can still vividly imagine today. The area offers numerous activities and beautiful sunsets, making it an excellent destination for a 4-5 day immersive visit.",Cultural/Historic Site,,,Hampi,5
